[
  {
    "slug": "fuck-anthropic",
    "name": "纸媒宣言 · Paper Manifesto",
    "tagline": "复古纸媒x粗野主义 — Georgia衬线大字报、边框网格、墨色反转hover、宣言黑底红影",
    "skill": "beautiful-html-templates",
    "template_type": "single-page",
    "design_style": "editorial",
    "aspect_ratio": "auto",
    "mood": ["激进", "复古", "宣言感", "粗野"],
    "occasion": ["公共声明", "倡议页面", "运动网站", "编辑精选"],
    "tone": ["宣言", "对抗", "批判"],
    "formality": "medium-high",
    "density": "medium",
    "scheme": "light",
    "palette": [
      { "name": "Paper", "color": "#f4efe7" },
      { "name": "Ink", "color": "#1b1916" },
      { "name": "Oxide", "color": "#b84f35" },
      { "name": "Oxide Dark", "color": "#8b3525" },
      { "name": "Sun", "color": "#d89a57" }
    ],
    "displayFont": "Georgia / Times New Roman / Noto Serif SC",
    "bodyFont": "Inter / PingFang SC / Microsoft YaHei",
    "typography_style": "Serif巨大标题(Georgia) + Sans-serif正文(Inter)，衬线/无衬线强对比，letter-spacing极窄",
    "best_for": "公共声明、倡议/请愿页面、社论专题、运动/活动站点、个人宣言",
    "avoid_for": "企业内部文档、数据报告、电商落地页",
    "features": ["citation"],
    "slide_count": 0,
    "css_variables": [
      { "name": "--paper", "default": "#f4efe7", "description": "页面背景纸色" },
      { "name": "--paper-deep", "default": "#e8dfd2", "description": "深纸色（panel背景）" },
      { "name": "--ink", "default": "#1b1916", "description": "主文字色/暗色块背景" },
      { "name": "--ink-soft", "default": "#5f5951", "description": "次级文字" },
      { "name": "--oxide", "default": "#b84f35", "description": "锈红强调色" },
      { "name": "--sun", "default": "#d89a57", "description": "琥珀高亮（引用左边框、manifesto按钮）" },
      { "name": "--display", "default": "Georgia, \"Times New Roman\", serif", "description": "展示字体栈" },
      { "name": "--body", "default": "Inter, system-ui, sans-serif", "description": "正文字体栈" }
    ],
    "visibility": "public",
    "status": "active",
    "template_path": "templates/beautiful-html-templates/fuck-anthropic/template.html"
  },
  {
    "slug": "template",
    "name": "归藏PPT · Style A 电子杂志",
    "tagline": "电子杂志 x 电子墨水 — Monocle式温润质感，5套配色主题，WebGL动态背景",
    "skill": "guizang-ppt-skill",
    "template_type": "slide-deck",
    "design_style": "editorial",
    "aspect_ratio": "16:9",
    "mood": [
      "温润",
      "杂志感",
      "人文"
    ],
    "occasion": [
      "品牌叙事",
      "文化内容",
      "设计提案",
      "个人作品集"
    ],
    "tone": [
      "雅致",
      "叙事"
    ],
    "formality": "medium",
    "density": "medium",
    "scheme": "mixed",
    "palette": [
      {
        "name": "Ink Classic",
        "color": "#1a1a1a"
      },
      {
        "name": "Indigo Porcelain",
        "color": "#2c3e6b"
      },
      {
        "name": "Forest Ink",
        "color": "#2d4a3e"
      },
      {
        "name": "Kraft Paper",
        "color": "#c4a35a"
      },
      {
        "name": "Dune",
        "color": "#d4a574"
      }
    ],
    "displayFont": "Noto Serif SC / Playfair Display",
    "bodyFont": "Noto Sans SC / IBM Plex Mono",
    "typography_style": "Serif标题 + Sans-serif正文 + Monospace元数据，有衬线/无衬线对比",
    "best_for": "品牌形象、杂志风内容、文化/艺术类PPT、有质感的叙事",
    "avoid_for": "数据密集报告、纯商务白底PPT",
    "features": [
      "chart"
    ],
    "slide_count": 0,
    "css_variables": [
      {
        "name": "--ink",
        "default": "#0a0a0b",
        "description": ""
      },
      {
        "name": "--ink-rgb",
        "default": "10,10,11",
        "description": ""
      },
      {
        "name": "--paper",
        "default": "#f1efea",
        "description": ""
      },
      {
        "name": "--paper-rgb",
        "default": "241,239,234",
        "description": ""
      },
      {
        "name": "--paper-tint",
        "default": "#e8e5de",
        "description": ""
      },
      {
        "name": "--ink-tint",
        "default": "#18181a",
        "description": ""
      },
      {
        "name": "--mono",
        "default": "\"IBM Plex Mono\",ui-monospace,monospace",
        "description": ""
      },
      {
        "name": "--serif-en",
        "default": "\"Playfair Display\",\"Source Serif 4\",Georgia,serif",
        "description": ""
      },
      {
        "name": "--serif-body-en",
        "default": "\"Source Serif 4\",Georgia,serif",
        "description": ""
      },
      {
        "name": "--serif-zh",
        "default": "\"Noto Serif SC\",source-han-serif-sc,serif",
        "description": ""
      },
      {
        "name": "--sans-zh",
        "default": "\"Noto Sans SC\",source-han-sans-sc,sans-serif",
        "description": ""
      }
    ],
    "visibility": "public",
    "preview_type": "iframe",
    "template_path": "templates/guizang-ppt-skill/template/template.html"
  },
  {
    "slug": "template-swiss",
    "name": "归藏PPT · Style B 瑞士国际主义",
    "tagline": "瑞士国际主义 — Helvetica Forever，碳网格系统，22种锁定布局，4色强调",
    "skill": "guizang-ppt-skill",
    "template_type": "slide-deck",
    "design_style": "swiss-minimal",
    "aspect_ratio": "16:9",
    "mood": [
      "理性",
      "极简",
      "秩序"
    ],
    "occasion": [
      "商业报告",
      "数据展示",
      "产品发布",
      "架构/系统提案"
    ],
    "tone": [
      "严谨",
      "权威"
    ],
    "formality": "high",
    "density": "high",
    "scheme": "light",
    "palette": [
      {
        "name": "IKB Blue",
        "color": "#002FA7"
      },
      {
        "name": "Lemon Yellow",
        "color": "#FFD700"
      },
      {
        "name": "Lemon Green",
        "color": "#00FF41"
      },
      {
        "name": "Safety Orange",
        "color": "#FF5F00"
      }
    ],
    "displayFont": "Inter / Noto Sans SC",
    "bodyFont": "Inter / JetBrains Mono",
    "typography_style": "全无衬线，极端字重对比(200→900)，12列模数网格",
    "best_for": "商业报告、数据密集展示、架构图、严谨提案",
    "avoid_for": "情感化叙事、文艺/手作风格",
    "features": [
      "chart"
    ],
    "slide_count": 0,
    "css_variables": [
      {
        "name": "--paper-rgb",
        "default": "250,250,248",
        "description": "主底色: 高级灰白"
      },
      {
        "name": "--ink-rgb",
        "default": "10,10,10",
        "description": "文字主色: 近黑"
      },
      {
        "name": "--grey-2",
        "default": "#d4d4d2",
        "description": "浅灰底"
      },
      {
        "name": "--grey-3",
        "default": "#737373",
        "description": "中灰(分割线)"
      },
      {
        "name": "--accent",
        "default": "#002FA7",
        "description": "暗灰(辅助文字)"
      },
      {
        "name": "--accent-rgb",
        "default": "0,47,167",
        "description": "高亮色: 克莱因蓝 IKB"
      },
      {
        "name": "--accent-bright",
        "default": "#5B7BFF",
        "description": "accent 上的反色文字"
      },
      {
        "name": "--text-secondary",
        "default": "#525252",
        "description": "= ink, 100%"
      },
      {
        "name": "--text-helper",
        "default": "#737373",
        "description": "gray 70"
      },
      {
        "name": "--text-placeholder",
        "default": "#a3a3a3",
        "description": "gray 60"
      },
      {
        "name": "--text-on-color",
        "default": "#ffffff",
        "description": "gray 40"
      },
      {
        "name": "--border-subtle",
        "default": "#e0e0e0",
        "description": "accent/dark 反色"
      },
      {
        "name": "--border-strong",
        "default": "#a3a3a3",
        "description": "gray 20, 极细分隔"
      },
      {
        "name": "--sp-4",
        "default": "12px",
        "description": "02 token"
      },
      {
        "name": "--sp-5",
        "default": "16px",
        "description": "03"
      },
      {
        "name": "--sp-6",
        "default": "24px",
        "description": "04"
      },
      {
        "name": "--sp-7",
        "default": "32px",
        "description": "05"
      },
      {
        "name": "--sp-8",
        "default": "40px",
        "description": "06"
      },
      {
        "name": "--sp-9",
        "default": "48px",
        "description": "07"
      },
      {
        "name": "--sp-10",
        "default": "64px",
        "description": "08"
      },
      {
        "name": "--sp-11",
        "default": "80px",
        "description": "09"
      },
      {
        "name": "--sp-12",
        "default": "96px",
        "description": "10"
      },
      {
        "name": "--sp-13",
        "default": "160px",
        "description": "11"
      },
      {
        "name": "--ease-exp",
        "default": "cubic-bezier(.4,.14,.3,1)",
        "description": "productive standard"
      },
      {
        "name": "--ease-entry-prod",
        "default": "cubic-bezier(0,0,.38,.9)",
        "description": "expressive standard"
      },
      {
        "name": "--ease-entry-exp",
        "default": "cubic-bezier(0,0,.3,1)",
        "description": "productive entrance"
      },
      {
        "name": "--dur-fast-1",
        "default": ".07s",
        "description": "expressive entrance"
      },
      {
        "name": "--dur-fast-2",
        "default": ".11s",
        "description": "70ms"
      },
      {
        "name": "--dur-mod-1",
        "default": ".15s",
        "description": "110ms"
      },
      {
        "name": "--dur-mod-2",
        "default": ".24s",
        "description": "150ms"
      },
      {
        "name": "--dur-slow-1",
        "default": ".4s",
        "description": "240ms"
      },
      {
        "name": "--dur-slow-2",
        "default": ".7s",
        "description": "400ms"
      },
      {
        "name": "--nav-safe-bottom",
        "default": "8vh",
        "description": "底部分页组件安全区: 主内容最低处不要进入这条区域"
      },
      {
        "name": "--paper",
        "default": "#fafaf8",
        "description": ""
      },
      {
        "name": "--ink",
        "default": "#0a0a0a",
        "description": ""
      },
      {
        "name": "--grey-1",
        "default": "#f0f0ee",
        "description": ""
      },
      {
        "name": "--accent-on",
        "default": "#ffffff",
        "description": ""
      },
      {
        "name": "--text-primary",
        "default": "#0a0a0a",